{
    "recommendation_id": "rec_bd7fe9cb3281a210",
    "report_id": "rr_m7-consultant-liability",
    "schema_version": "1.0",
    "lifecycle_stage": "recommendation_ready",
    "recommendation": "pursue",
    "priority": "medium",
    "content_type": "guide",
    "score": 71.2,
    "criteria": {
        "intent_fit": 1.0,
        "serp_opportunity": 0.6,
        "business_value": 0.25,
        "authority_fit": 0.81,
        "research_completeness": 1.0
    },
    "rationale": [
        "Intent fit scored 1.00.",
        "SERP opportunity scored 0.60.",
        "Business value scored 0.25.",
        "Authority fit scored 0.81.",
        "Research completeness scored 1.00.",
        "Current evidence supports pursuing the opportunity."
    ],
    "evidence_refs": [
        "ev_9a2aedbda182447f",
        "ev_serp_result_e444932ffdbdcf4c",
        "ev_serp_result_ff1b4f79644246be",
        "ev_serp_result_a313311899a979c3",
        "ev_serp_result_c1d68f3c48a13f97",
        "ev_serp_result_cba8fb55be152463",
        "ev_serp_distribution_5bd5f8181a2685d0",
        "ev_serp_dominant_5bd5f8181a2685d0",
        "ev_serp_mixed_5bd5f8181a2685d0",
        "ev_intent_alignment_b80d94868d8444df",
        "ev_serp_strategy_ad409d2a44c3792b",
        "ev_b68e2e74a3d8d68d7f0b6f28",
        "ev_d0ee01a51f13063e7d47c3d3",
        "ev_f27f204e172f0bc28f509ce8",
        "ev_ad6b4817da573d3539e55967",
        "ev_7be8f8d28256603c97e78523",
        "ev_9e4fd2bf505c53588b7dca01",
        "ev_75c4849a49f1e0ec17c3ca9d",
        "ev_3c101e172deffec73fc173d2",
        "ev_e08d48a1e6c8769e7f384c56",
        "ev_11d67e0727eee22468ec7721",
        "ev_c4d36efbb9712e7962801f0a",
        "ev_4facf32aac256200c3945fd1",
        "ev_aacb3b16843de77896baf355",
        "ev_c6ca61471538bfcf327d46a6",
        "ev_99663307d0614f16c33e393b",
        "ev_e4c24c3305be8fd806939e56",
        "ev_b157e1257743122ff7d6c68b",
        "ev_db081695cfad6d9d69e187b8",
        "ev_259d00013793f1213fcd7cd7"
    ],
    "audit": {
        "method": "weighted_research_opportunity_score",
        "version": "v1",
        "validation_status": "pending"
    }
}