{
    "recommendation_id": "rec_12755891ec68d5e4",
    "report_id": "rr_expat-health-insurance",
    "schema_version": "1.0",
    "lifecycle_stage": "recommendation_ready",
    "recommendation": "pursue",
    "priority": "high",
    "content_type": "guide",
    "score": 81.17,
    "criteria": {
        "intent_fit": 1.0,
        "serp_opportunity": 0.8889,
        "business_value": 0.25,
        "authority_fit": 0.9472,
        "research_completeness": 1.0
    },
    "rationale": [
        "Intent fit scored 1.00.",
        "SERP opportunity scored 0.89.",
        "Business value scored 0.25.",
        "Authority fit scored 0.95.",
        "Research completeness scored 1.00.",
        "Current evidence supports pursuing the opportunity."
    ],
    "evidence_refs": [
        "ev_454e683da39cd64e",
        "ev_serp_result_8c55baaa568b274e",
        "ev_serp_result_9fca0aafc956a04f",
        "ev_serp_result_27c34d1b9fd94a85",
        "ev_serp_result_934b1f0f571fbebc",
        "ev_serp_result_45fad6e64d09c0fa",
        "ev_serp_result_ec809fb47b6a343c",
        "ev_serp_result_4413a1140f635b3d",
        "ev_serp_result_1872aaa543564c6b",
        "ev_serp_result_892a0c39ffc23f0e",
        "ev_serp_distribution_23165a6f509de19b",
        "ev_serp_dominant_23165a6f509de19b",
        "ev_serp_mixed_23165a6f509de19b",
        "ev_intent_alignment_91b405f6a64df87f",
        "ev_serp_strategy_233923c86c15a3ff",
        "ev_1f7c321cdd7bbdefe1b7855f",
        "ev_66f8572090e5cf1c0bb2a707",
        "ev_13ef75e026eb0bd9b79113c1",
        "ev_50e9829c101f7598b6abbed2",
        "ev_e46114e2a051b4e33b77ea50",
        "ev_28b89e80c06138321f65204e",
        "ev_4912cc056c11898cfd31b559",
        "ev_41ce894922a669e77259fe8d",
        "ev_a4f6407a46d260fa22115039",
        "ev_bc9ff3dcb9f285126eaa9056",
        "ev_9b0ec503dd8840276bbd1920",
        "ev_e0a5ce381840068fecf3b3df",
        "ev_966b60767ec46c4b67169fe5",
        "ev_c8691b781dd1015730fd7ed9",
        "ev_95b314fd4ffaf1a9d24ca9f3",
        "ev_d5eaa5677934b1b915cd1bdc",
        "ev_3208ff0460e2eac3dbfb4281",
        "ev_63d7e6223b14df00ac60858a",
        "ev_1c9e5d9ea6c70ffa5f47e7b9",
        "ev_8339719bc6939f1323a34b60",
        "ev_ed51b02715143f81635f7151",
        "ev_f6c60ce0bfdde4c3d62c2f96",
        "ev_8524552715be757833bbad8b",
        "ev_4f502e2cf646837ad3f36c8d",
        "ev_34d5b8c82a8a2b98aee648dc",
        "ev_1bf31d73d0b60edf2c380eb9",
        "ev_07fc4e7394d17a0f39bcc541",
        "ev_f84050d29bd3788b8db432d4",
        "ev_b633ce73305b1d2c88449135",
        "ev_d0907041f5ed42b9daf437e3",
        "ev_7b92ea8033047a27cfc7dd90",
        "ev_45682e20adad3758e08109db",
        "ev_7728da4194f34bd5e6a1cf77",
        "ev_a55b2cd0b14d31d8f94c3634"
    ],
    "audit": {
        "method": "weighted_research_opportunity_score",
        "version": "v1",
        "validation_status": "pending"
    }
}